{
  "approval_id": "apr_contract",
  "tenant_id": "tenant-a",
  "trace_id": "tr_contract",
  "tool_call": {
    "tool_name": "delete_repository",
    "input": {"repo": "core"},
    "schema": {
      "type": "object",
      "properties": {"repo": {"type": "string", "minLength": 1}},
      "required": ["repo"],
      "additionalProperties": false
    },
    "risk_level": "high",
    "approval_required": true,
    "caller_context": {
      "subject": "agent-7"
    }
  },
  "status": "pending",
  "risk_level": "high",
  "reason": "Tool call is high-risk and requires approval.",
  "requested_by": "agent-7",
  "decided_by": null,
  "decision_reason": null,
  "created_at": "2026-07-08T00:00:00Z",
  "decided_at": null
}
